<?xml version="1.0" encoding="utf-8" ?>

<SupportedApplications
  xmlns="http://whatodo.at/abc/abc-api/SupportedApplications"
  xmlns:xsi="http://www.w3.org/2001/XMLSchema-instance"
  xsi:schemaLocation="http://whatodo.at/abc/abc-api SupportedApplications.xsd">

  <Application Author ="Microsoft Corporation" Guid="{8E3C1F5A-6970-49A2-8D41-5224169A0804}" Name="Windows 7">
    <TargetExecutables>
      <Executable Guid="{FC7783D8-988B-4C3B-AD24-6CA241568199}" ProcessName="explorer" CompanyName="Microsoft Corporation" />
      <Executable Guid="{ED7A078D-DE93-4EC4-AB7D-A5B7CBDDFE55}" ProcessName="Dxpserver" CompanyName="Microsoft Corporation"/>
      <Executable Guid="{E32105B4-0506-43C7-8F48-777CDAA67183}" ProcessName="wisptis" CompanyName="Microsoft Corporation"/>
      <Executable Guid="{F0A626EB-AC17-4157-8363-0E965C657BB7}" ProcessName="taskhost" CompanyName="Microsoft Corporation"/>
    </TargetExecutables>
    <Plugins>
      <Plugin Version="1.0" Author="TestAuthor" icon="TestIcon.ico" Description="Provides some functionality 1">
        <AbcPlugins>
          <AbcPlugin Guid="{AC0385EB-66BA-49F5-B276-ECC6246D621C}" TargetVersion="1.0"/>
          <AbcPlugin Guid="{C0585332-8F2E-448B-9931-AF86399C020B}" TargetVersion="2.0"/>
        </AbcPlugins>
      </Plugin>
    </Plugins>
  </Application>

</SupportedApplications>